{
  "specversion": "1.0",
  "id": "sim-a-000005",
  "source": "urn:ottoq:src:sim-a:SIMA-0001",
  "type": "com.ottoyard.directive.ack",
  "time": "2026-10-09T14:00:00Z",
  "datacontenttype": "application/json",
  "dataschema": "https://ottoyard.com/schemas/ottoq/contract/0.1/directive.ack.json",
  "subject": "SIMA-0001",
  "sequence": "00000000000000000005",
  "data": {
    "directive_id": "0b7c6f2e-8a51-4f3e-9d6a-3c1f2b9e7a10",
    "directive_version": 1,
    "disposition": "unable",
    "reason": "charger_fault",
    "detail": "Connector would not latch.",
    "observed_at": "2026-10-09T14:04:10Z"
  }
}
