{
  "specversion": "1.0",
  "id": "ottoq-000005",
  "source": "urn:ottoq:depot:11111111-1111-1111-1111-111111111111",
  "type": "com.ottoyard.capacity.offer",
  "time": "2026-10-09T14:01:00Z",
  "datacontenttype": "application/json",
  "dataschema": "https://ottoyard.com/schemas/ottoq/contract/0.1/capacity.offer.json",
  "data": {
    "window": {"start": "2026-10-09T15:00:00Z", "end": "2026-10-09T18:00:00Z"},
    "held_for_you": {"dcfc": 3, "l2": 8, "staging": 12},
    "charge_wait_band": "under_15_min"
  },
  "ottoqsig": "eyJhbGciOiJFZDI1NTE5Iiwia2lkIjoicmZjODAzNy1hMS10ZXN0LWtleSJ9..201a2D8ZVG5hxsdtz8MJiQCEmcd2DI92DM6L9JIEU2YmgFsZlyIhYwPf8diboyMyma6jRCEbF789_Pk5l0_mDw"
}
