{
  "specversion": "1.0",
  "id": "ottoq-000004",
  "source": "urn:ottoq:depot:11111111-1111-1111-1111-111111111111",
  "type": "com.ottoyard.readiness.forecast",
  "time": "2026-10-09T14:01:00Z",
  "datacontenttype": "application/json",
  "dataschema": "https://ottoyard.com/schemas/ottoq/contract/0.1/readiness.forecast.json",
  "data": {
    "vehicle_ref": "SIMA-0001",
    "as_of": "2026-10-09T14:01:00Z",
    "ready_p50": "2026-10-09T15:20:00Z",
    "ready_p90": "2026-10-09T15:45:00Z",
    "soc_at_ready_pct": 100,
    "open_services": ["charge", "sensor_clean", "interior_tidy"]
  },
  "ottoqsig": "eyJhbGciOiJFZDI1NTE5Iiwia2lkIjoicmZjODAzNy1hMS10ZXN0LWtleSJ9.._AZJjy01OYTfD60In5Ft2baf4e6c5G8HysRVPJ0JCF_zjEr0pidmaRo_zStKlDJmrDeV6VyWTJjpBRZ3zth0Cw",
  "subject": "SIMA-0001"
}
