{
  "specversion": "1.0",
  "id": "ottoq-000003",
  "source": "urn:ottoq:depot:11111111-1111-1111-1111-111111111111",
  "type": "com.ottoyard.directive.service.schedule",
  "time": "2026-10-09T14:01:00Z",
  "datacontenttype": "application/json",
  "dataschema": "https://ottoyard.com/schemas/ottoq/contract/0.1/directive.service.schedule.json",
  "data": {
    "directive_id": "9e4f1c2a-7b3d-4e5f-8a6b-1c2d3e4f5a60",
    "version": 1,
    "supersedes": null,
    "issued_at": "2026-10-09T14:01:00Z",
    "valid_from": "2026-10-09T14:01:00Z",
    "expires_at": "2026-10-09T14:31:00Z",
    "ack_deadline": "2026-10-09T14:06:00Z",
    "vehicle_ref": "SIMA-0001",
    "operations": [
      {
        "service_code": "sensor_clean",
        "stall_code": "DC-04",
        "window": {"start": "2026-10-09T14:30:00Z", "end": "2026-10-09T14:35:00Z"}
      },
      {
        "service_code": "interior_tidy",
        "stall_code": "DC-04",
        "window": {"start": "2026-10-09T14:35:00Z", "end": "2026-10-09T14:40:00Z"}
      }
    ]
  },
  "ottoqsig": "eyJhbGciOiJFZDI1NTE5Iiwia2lkIjoicmZjODAzNy1hMS10ZXN0LWtleSJ9..khGaPy0vY1aglLCCAKGfsHrzC1V5B6VumeOJmfL9zgt-MGYIlwkXfMjjb05xXECPmwD-HX8yjq-rxxVmsP5VCg",
  "subject": "SIMA-0001"
}
