{
  "specversion": "1.0",
  "id": "sim-a-000004",
  "source": "urn:ottoq:src:sim-a:SIMA-0001",
  "type": "com.ottoyard.vehicle.departed",
  "time": "2026-10-09T14:00:00Z",
  "datacontenttype": "application/json",
  "dataschema": "https://ottoyard.com/schemas/ottoq/contract/0.1/vehicle.departed.json",
  "subject": "SIMA-0001",
  "sequence": "00000000000000000004",
  "data": {"departed_at": "2026-10-09T16:31:00Z", "reason": "dispatched", "soc_pct": 100}
}
